[
  {
    "id": "hobbiton",
    "name": "Hobbiton",
    "type": "aldea",
    "region": "La Comarca",
    "coords": [370, 1088],
    "zoomMin": -3
  },
  {
    "id": "bolson-cerrado",
    "name": "Bolsón Cerrado",
    "altNames": ["Bag End"],
    "type": "morada",
    "region": "La Comarca",
    "coords": [367, 1092],
    "zoomMin": 3
  },
  {
    "id": "delagua",
    "name": "Delagua",
    "altNames": ["Bywater"],
    "type": "aldea",
    "region": "La Comarca",
    "coords": [379, 1084],
    "zoomMin": 2
  },
  {
    "id": "cavada-grande",
    "name": "Cavada Grande",
    "altNames": ["Michel Delving"],
    "type": "aldea",
    "region": "La Comarca",
    "coords": [318, 1072],
    "zoomMin": 0
  },
  {
    "id": "alforzaburgo",
    "name": "Alforzaburgo",
    "altNames": ["Tuckborough"],
    "type": "aldea",
    "region": "La Comarca",
    "coords": [342, 1058],
    "zoomMin": 1
  },
  {
    "id": "ranales",
    "name": "Ranales",
    "altNames": ["Frogmorton"],
    "type": "aldea",
    "region": "La Comarca",
    "coords": [392, 1089],
    "zoomMin": 2
  },
  {
    "id": "surcos-blancos",
    "name": "Surcos Blancos",
    "altNames": ["Whitfurrows"],
    "type": "aldea",
    "region": "La Comarca",
    "coords": [401, 1087],
    "zoomMin": 3
  },
  {
    "id": "casa-del-bosque",
    "name": "Casa del Bosque",
    "altNames": ["Woodhall"],
    "type": "aldea",
    "region": "La Comarca",
    "coords": [398, 1072],
    "zoomMin": 3
  },
  {
    "id": "cepeda",
    "name": "Cepeda",
    "altNames": ["Stock"],
    "type": "aldea",
    "region": "La Comarca",
    "coords": [406, 1063],
    "zoomMin": 2
  },
  {
    "id": "granja-de-maggot",
    "name": "Granja de Maggot",
    "altNames": ["Farmer Maggot's farm", "Bamfurlong"],
    "type": "morada",
    "region": "La Comarca",
    "coords": [405, 1057],
    "zoomMin": 3
  },
  {
    "id": "balsadera-de-gamoburgo",
    "name": "Balsadera de Gamoburgo",
    "altNames": ["Bucklebury Ferry"],
    "type": "vado",
    "region": "Los Gamos",
    "coords": [412, 1067],
    "zoomMin": 3
  },
  {
    "id": "gamoburgo",
    "name": "Gamoburgo",
    "altNames": ["Bucklebury"],
    "type": "aldea",
    "region": "Los Gamos",
    "coords": [418, 1062],
    "zoomMin": 2
  },
  {
    "id": "casa-brandi",
    "name": "Casa Brandi",
    "altNames": ["Brandy Hall"],
    "type": "morada",
    "region": "Los Gamos",
    "coords": [417, 1067],
    "zoomMin": 3
  },
  {
    "id": "cricava",
    "name": "Cricava",
    "altNames": ["Crickhollow"],
    "type": "morada",
    "region": "Los Gamos",
    "coords": [421, 1058],
    "zoomMin": 3
  },
  {
    "id": "puente-del-brandivino",
    "name": "Puente del Brandivino",
    "altNames": ["Brandywine Bridge", "Puente de los Arcos de Piedra"],
    "type": "puente",
    "region": "La Comarca",
    "coords": [410, 1083],
    "zoomMin": 1
  },
  {
    "id": "puerta-del-seto",
    "name": "Puerta del Seto",
    "altNames": ["Hay Gate", "Puerta de Los Gamos"],
    "type": "puerta",
    "region": "Los Gamos",
    "coords": [424, 1079],
    "zoomMin": 3
  },
  {
    "id": "vado-sarn",
    "name": "Vado Sarn",
    "altNames": ["Sarn Ford"],
    "type": "vado",
    "region": "La Comarca",
    "coords": [420, 952],
    "zoomMin": 1
  },
  {
    "id": "casa-de-tom-bombadil",
    "name": "Casa de Tom Bombadil",
    "altNames": ["Tom Bombadil's house"],
    "type": "morada",
    "region": "Bosque Viejo",
    "coords": [460.6, 1051],
    "zoomMin": 1
  },
  {
    "id": "tumulos",
    "name": "Túmulos",
    "altNames": ["Barrow-downs", "Tyrn Gorthad"],
    "type": "colina",
    "region": "Quebradas de los Túmulos",
    "coords": [464.1, 1060],
    "zoomMin": 2
  },
  {
    "id": "bree",
    "name": "Bree",
    "type": "aldea",
    "region": "Tierra de Bree",
    "coords": [471, 1075],
    "zoomMin": -2
  },
  {
    "id": "entibo",
    "name": "Entibo",
    "altNames": ["Staddle"],
    "type": "aldea",
    "region": "Tierra de Bree",
    "coords": [479.6, 1069],
    "zoomMin": 3
  },
  {
    "id": "combe",
    "name": "Combe",
    "type": "aldea",
    "region": "Tierra de Bree",
    "coords": [485.8, 1077],
    "zoomMin": 3
  },
  {
    "id": "archet",
    "name": "Archet",
    "type": "aldea",
    "region": "Tierra de Bree",
    "coords": [493.2, 1085],
    "zoomMin": 3
  },
  {
    "id": "pantanos-de-moscagua",
    "name": "Pantanos de Moscagua",
    "altNames": ["Midgewater Marshes"],
    "type": "lugar",
    "region": "Eriador",
    "coords": [561.1, 1073],
    "zoomMin": 1
  },
  {
    "id": "cima-de-los-vientos",
    "name": "Cima de los Vientos",
    "altNames": ["Amon Sûl", "Weathertop"],
    "type": "colina",
    "region": "Eriador",
    "coords": [611.7, 1078],
    "zoomMin": -1
  },
  {
    "id": "ultimo-puente",
    "name": "Último Puente",
    "altNames": ["Last Bridge", "Puente de Mitheithel"],
    "type": "puente",
    "region": "Eriador",
    "coords": [770, 1070],
    "zoomMin": 0
  },
  {
    "id": "trolls-de-piedra",
    "name": "Trolls de piedra",
    "altNames": ["Stone trolls"],
    "type": "lugar",
    "region": "Bosque de los Trolls",
    "coords": [812, 1085],
    "zoomMin": 2
  },
  {
    "id": "vado-del-bruinen",
    "name": "Vado del Bruinen",
    "altNames": ["Ford of Bruinen", "Vado de Rivendel"],
    "type": "vado",
    "region": "Eriador",
    "coords": [835, 1055],
    "zoomMin": 0
  },
  {
    "id": "rivendel",
    "name": "Rivendel",
    "altNames": ["Imladris", "Rivendell"],
    "type": "morada",
    "region": "Eriador",
    "coords": [860, 1060],
    "zoomMin": -3
  },
  {
    "id": "acebeda",
    "name": "Acebeda",
    "altNames": ["Eregion", "Hollin"],
    "type": "lugar",
    "region": "Eriador",
    "coords": [858, 932],
    "zoomMin": 0
  },
  {
    "id": "tharbad",
    "name": "Tharbad",
    "type": "ruina",
    "region": "Eriador",
    "coords": [660, 820],
    "zoomMin": -1
  },
  {
    "id": "fornost",
    "name": "Fornost",
    "altNames": ["Norburgo de los Reyes", "Deadmen’s Dike"],
    "type": "ruina",
    "region": "Eriador",
    "coords": [530, 1222],
    "zoomMin": -1
  },
  {
    "id": "annuminas",
    "name": "Annúminas",
    "type": "ruina",
    "region": "Eriador",
    "coords": [314, 1238],
    "zoomMin": 0
  },
  {
    "id": "puertos-grises",
    "name": "Puertos Grises",
    "altNames": ["Mithlond", "Grey Havens"],
    "type": "puerto",
    "region": "Lindon",
    "coords": [178, 1086],
    "zoomMin": -2
  },
  {
    "id": "torres-blancas",
    "name": "Torres Blancas",
    "altNames": ["Elostirion", "White Towers"],
    "type": "torre",
    "region": "Colinas de las Torres",
    "coords": [229, 1083],
    "zoomMin": 1
  },
  {
    "id": "paso-alto",
    "name": "Paso Alto",
    "altNames": ["High Pass", "Cirith Forn en Andrath"],
    "type": "paso",
    "region": "Montañas Nubladas",
    "coords": [916, 1076],
    "zoomMin": 0
  },
  {
    "id": "paso-del-caradhras",
    "name": "Paso del Cuerno Rojo",
    "altNames": ["Paso del Caradhras", "Redhorn Pass", "Puerta del Cuerno Rojo"],
    "type": "paso",
    "region": "Montañas Nubladas",
    "coords": [912, 918],
    "zoomMin": 1
  },
  {
    "id": "puertas-de-moria",
    "name": "Puertas de Durin",
    "altNames": ["Puerta del Oeste de Moria", "West-gate", "Doors of Durin"],
    "type": "puerta",
    "region": "Moria",
    "coords": [888, 900],
    "zoomMin": 1
  },
  {
    "id": "moria",
    "name": "Moria",
    "altNames": ["Khazad-dûm", "Minas de Moria"],
    "type": "ciudad",
    "region": "Montañas Nubladas",
    "coords": [905, 899],
    "zoomMin": -2
  },
  {
    "id": "camara-de-mazarbul",
    "name": "Cámara de Mazarbul",
    "altNames": ["Chamber of Mazarbul", "Cámara de los Registros"],
    "type": "lugar",
    "region": "Moria",
    "coords": [913, 900],
    "zoomMin": 3
  },
  {
    "id": "puente-de-khazad-dum",
    "name": "Puente de Khazad-dûm",
    "altNames": ["Bridge of Khazad-dûm", "Puente de Durin"],
    "type": "puente",
    "region": "Moria",
    "coords": [920, 898],
    "zoomMin": 2
  },
  {
    "id": "valle-del-arroyo-sombrio",
    "name": "Valle del Arroyo Sombrío",
    "altNames": ["Azanulbizar", "Nanduhirion", "Dimrill Dale"],
    "type": "valle",
    "region": "Montañas Nubladas",
    "coords": [933, 905],
    "zoomMin": 1
  },
  {
    "id": "gundabad",
    "name": "Gundabad",
    "altNames": ["Monte Gundabad"],
    "type": "fortaleza",
    "region": "Montañas Nubladas",
    "coords": [960, 1375],
    "zoomMin": 1
  },
  {
    "id": "cerin-amroth",
    "name": "Cerin Amroth",
    "type": "colina",
    "region": "Lothlórien",
    "coords": [980, 906],
    "zoomMin": 2
  },
  {
    "id": "caras-galadhon",
    "name": "Caras Galadhon",
    "type": "ciudad",
    "region": "Lothlórien",
    "coords": [997, 893],
    "zoomMin": -2
  },
  {
    "id": "egladil",
    "name": "Egladil",
    "altNames": ["El Ángulo", "Naith de Lórien", "Tongue"],
    "type": "lugar",
    "region": "Lothlórien",
    "coords": [1020, 886],
    "zoomMin": 2
  },
  {
    "id": "sarn-gebir",
    "name": "Sarn Gebir",
    "type": "cascada",
    "region": "Anduin",
    "coords": [1046, 735],
    "zoomMin": 1
  },
  {
    "id": "argonath",
    "name": "Argonath",
    "altNames": ["Pilares de los Reyes", "Pillars of the Kings"],
    "type": "puerta",
    "region": "Anduin",
    "coords": [1049, 703],
    "zoomMin": 0
  },
  {
    "id": "tol-brandir",
    "name": "Tol Brandir",
    "altNames": ["Tindrock"],
    "type": "monte",
    "region": "Nen Hithoel",
    "coords": [1053, 651],
    "zoomMin": 2,
    "onWater": true
  },
  {
    "id": "parth-galen",
    "name": "Parth Galen",
    "type": "campo",
    "region": "Nen Hithoel",
    "coords": [1046, 649],
    "zoomMin": 2
  },
  {
    "id": "amon-hen",
    "name": "Amon Hen",
    "altNames": ["Colina del Ojo", "Hill of Sight"],
    "type": "colina",
    "region": "Emyn Muil",
    "coords": [1040, 652],
    "zoomMin": -2
  },
  {
    "id": "amon-lhaw",
    "name": "Amon Lhaw",